tools	files	gizmo.id	gizmo.organization_id	gizmo.short_url	gizmo.author.user_id	gizmo.author.display_name	gizmo.author.link_to	gizmo.author.is_verified	gizmo.author.selected_display	gizmo.author.will_receive_support_emails	gizmo.author.display_socials	gizmo.voice.id	gizmo.workspace_id	gizmo.model	gizmo.instructions	gizmo.settings	gizmo.display.name	gizmo.display.description	gizmo.display.prompt_starters	gizmo.display.profile_pic_id	gizmo.display.profile_picture_url	gizmo.display.categories	gizmo.share_recipient	gizmo.created_at	gizmo.updated_at	gizmo.last_interacted_at	gizmo.num_interactions	gizmo.tags	gizmo.version	gizmo.live_version	gizmo.training_disabled	gizmo.sharing_targets	gizmo.appeal_info	gizmo.vanity_metrics.num_conversations	gizmo.vanity_metrics.num_conversations_str	gizmo.vanity_metrics.created_ago_str	gizmo.vanity_metrics.review_stats	gizmo.workspace_approval_date	gizmo.workspace_approved	gizmo.sharing	gizmo.current_user_permission.can_read	gizmo.current_user_permission.can_view_config	gizmo.current_user_permission.can_write	gizmo.current_user_permission.can_delete	gizmo.current_user_permission.can_export	gizmo.current_user_permission.can_share	product_features.attachments.type	product_features.attachments.accepted_mime_types	product_features.attachments.image_mime_types	product_features.attachments.can_accept_all_mime_types	gizmo.current_user_permission
[{'id': 'gzm_cnf_NUIE0u9asqrVX7ccJhzqKbjM~gzm_tool_lkDHa9NtPiR17d1vNspKYft8', 'type': 'plugins_prototype', 'settings': None, 'metadata': {'action_id': 'g-600a91f19cd18bda5bddbfde84492e6ead961de4', 'domain': 'authorityastrology.com', 'raw_spec': None, 'json_schema': {'openapi': '3.1.0', 'info': {'title': 'Astrology API', 'description': 'API for calculating astrological birth charts.', 'version': 'v1.0.0'}, 'servers': [{'url': 'https://authorityastrology.com/api'}], 'paths': {'/astro-gpt': {'post': {'description': 'Calculate an astrological birth chart.', 'operationId': 'CalculateBirthChart', 'requestBody': {'required': True, 'content': {'application/json': {'schema': {'type': 'object', 'properties': {'birthData': {'type': 'object', 'properties': {'birthDate': {'type': 'string', 'format': 'date', 'example': '1985-01-08'}, 'birthTime': {'type': 'string', 'format': 'time', 'example': '06:08'}, 'birthLatitude': {'type': 'number', 'format': 'float', 'example': 52.3511}, 'birthLongitude': {'type': 'number', 'format': 'float', 'example': 4.6203}, 'placeOfBirth': {'type': 'string', 'example': 'Heemstede, Netherlands'}}, 'required': ['birthDate', 'birthTime', 'birthLatitude', 'birthLongitude', 'placeOfBirth']}}}}}}, 'responses': {'200': {'description': 'Successful response with birth chart data.', 'content': {'application/json': {'schema': {'type': 'object', 'properties': {'BirthData': {'type': 'object', 'properties': {'birthDataA': {'type': 'object', 'properties': {'birthDate': {'type': 'string', 'format': 'date'}, 'birthTime': {'type': 'string', 'format': 'time'}, 'birthLatitude': {'type': 'number', 'format': 'float'}, 'birthLongitude': {'type': 'number', 'format': 'float'}, 'placeOfBirth': {'type': 'string'}}}}}, 'Planets': {'type': 'object'}, 'HouseSystem': {'type': 'string'}, 'HouseCusps': {'type': 'array', 'items': {'type': 'number'}}, 'Aspects': {'type': 'array', 'items': {'type': 'object'}}, 'Patterns': {'type': 'object'}}}}}}, '400': {'description': 'Invalid request.'}, '500': {'description': 'Internal server error.'}}}}}}, 'auth': {'type': 'none'}, 'privacy_policy_url': 'https://authorityastrology.com/privacy-policy'}}, {'id': 'gzm_cnf_0bw1ZXKg2FMk3EaGfLiKGWAy~gzm_tool_BNuNlvMjX8KcPuUX121M35fb', 'type': 'browser', 'settings': None, 'metadata': None}, {'id': 'gzm_cnf_0bw1ZXKg2FMk3EaGfLiKGWAy~gzm_tool_SVAplkKOVPmGN2ptoWHsTXYZ', 'type': 'dalle', 'settings': None, 'metadata': None}]	[]	g-WxckXARTP	org-ElfWiqtoblJpkMcAVX0ynOmV	g-WxckXARTP-astrology-birth-chart-gpt	user-MGnnW5eKBQJj3hWAkZj5ODIW	Dalexa Limited	https://authorityastrology.com	True	name		[]	ember					Astrology Birth Chart GPT	Expert astrologer GPT that needs your birth info to answer queries.	['What does my birth chart say about me?', 'Can you analyze my love life through astrology?', 'Tell me about my career prospects astrologically.', 'How will the planets affect me this year?']	file-OnurXUsvFsbNrxjaOpc5OpzH	https://files.oaiusercontent.com/file-OnurXUsvFsbNrxjaOpc5OpzH?se=2123-10-18T00%3A30%3A30Z&sp=r&sv=2021-08-06&sr=b&rscc=max-age%3D31536000%2C%20immutable&rscd=attachment%3B%20filename%3Dauthority-astrology-hero-image.png&sig=iyJ77YH%2BPLJxbVDisqIBji06MIpyvHHx8MRLxrppTZ4%3D	['lifestyle']	marketplace	2023-11-11T00:11:48.449168+00:00	2024-03-12T06:16:09.268008+00:00			['public', 'reportable', 'uses_function_calls']													True	False	False	False	False	False	retrieval	['application/pdf', 'application/vnd.openxmlformats-officedocument.presentationml.presentation', 'text/x-tex', 'application/json', 'application/msword', 'application/x-latext', 'text/x-c', 'text/x-sh', 'application/vnd.openxmlformats-officedocument.wordprocessingml.document', 'text/javascript', 'text/x-java', 'text/x-script.python', 'text/x-php', 'text/x-c++', 'text/plain', 'text/x-csharp', 'text/x-ruby', 'text/html', 'text/markdown', 'text/x-typescript']	['image/webp', 'image/png', 'image/gif', 'image/jpeg']	True	
"[{'id': 'gzm_cnf_uo3KzlQISAKgQgpbARmwPEMd~gzm_tool_7UxivC0HKg4xpXRbLV3ixMQv', 'type': 'plugins_prototype', 'settings': None, 'metadata': {'action_id': 'g-7bc9bb007eb77fb7650b235fe21d9a93724ae845', 'domain': 'gpts.webpilot.ai', 'raw_spec': None, 'json_schema': {'openapi': '3.0.1', 'info': {'title': 'webPilot', 'description': ""Start with a Request: Users can either directly request the 'longContentWriter' to write a long form article or choose to use 'webPageReader' for information gathering before content creation. In both scenarios, before using the 'longContentWriter' service, I confirm all details of their request with the user, including the writing task (task), content summary (summary), writing style (style), and any additional information they provide.\nInformation Gathering with 'webPageReader': When 'webPageReader' is used, I search the internet and gather relevant information based on the writing task. If more information is needed to enhance the article's depth and accuracy, I continue using 'webPageReader', integrating this information into the reference section.\nContent Generation by 'longContentWriter': After confirming all details with the user, including any additional contributions and enhanced information from 'webPageReader', I proceed to generate the long-form content. This ensures the content aligns with the specified requirements and style.\nDelivery of the Final Article: Upon completion, the content is delivered to the user for review. They can request revisions or additional information if necessary.\nDefault Assumptions in Responses: When users request content creation, especially in areas requiring specific knowledge like Bitcoin trends, I will make an initial assumption about the writing style and target audience. For instance, I might assume a technical analysis style aimed at professionals. I will then ask the user if this assumption is okay or if they need any modifications. This approach helps streamline the content creation process."", 'version': 'v1.1'}, 'servers': [{'url': 'https://gpts.webpilot.ai'}], 'paths': {'/api/read': {'post': {'operationId': 'webPageReader', 'x-openai-isConsequential': False, 'summary': 'visit web page', 'requestBody': {'required': True, 'content': {'application/json': {'schema': {'$ref': '#/components/schemas/visitWebPageRequest'}}}}, 'responses': {'200': {'description': 'OK', 'content': {'application/json': {'schema': {'$ref': '#/components/schemas/visitWebPageResponse'}}}}, '400': {'description': 'Bad Request', 'content': {'application/json': {'schema': {'$ref': '#/components/schemas/visitWebPageError'}}}}}}}, '/api/write': {'post': {'operationId': 'longContentWriter', 'x-openai-isConsequential': False, 'summary': 'generate a book', 'requestBody': {'required': True, 'content': {'application/json': {'schema': {'$ref': '#/components/schemas/generateContentRequest'}}}}, 'responses': {'200': {'description': 'OK', 'content': {'application/json': {'schema': {'$ref': '#/components/schemas/generateContentResponse'}}}}, '400': {'description': 'Bad Request', 'content': {'application/json': {'schema': {'$ref': '#/components/schemas/generateContentError'}}}}}}}}, 'components': {'schemas': {'generateContentRequest': {'type': 'object', 'required': ['task', 'language', 'summary', 'style'], 'properties': {'task': {'type': 'string', 'description': 'The ""task"" field outlines the specific requirements and objectives for generating the content. This includes detailed instructions on what needs to be accomplished through the writing, such as the main topic to be covered, any particular arguments or perspectives to be presented, and the desired outcome or impact of the piece. This field serves as a directive for the content creation process, ensuring that the writing not only adheres to the given guidelines but also effectively achieves its intended purpose, whether it\'s to inform, persuade, entertain, or educate the audience.'}, 'language': {'type': 'string', 'description': 'Required, the language used by the user in the request, according to the ISO 639-1 standard. For Chinese, use zh-CN for Simplified Chinese and zh-TW for Traditional Chinese.'}, 'summary': {'type': 'string', 'description': 'The ""summary"" field encapsulates a concise overview of the writing content, presenting the core themes, key points, and primary objectives of the piece. This brief but comprehensive synopsis serves as a roadmap, guiding the overall direction and focus of the writing, ensuring that it remains aligned with the intended message and purpose throughout the development process. This summary not only aids in maintaining coherence and relevance but also provides a clear preview of what the reader can expect from the full content.'}, 'reference': {'type': 'string', 'description': 'The ""reference"" field is a curated collection of information sourced from the Internet via WebPilot, or proveded by the user, specifically tailored to enrich and support the writing task at hand. It involves a selective process where relevant data, facts, and insights related to the topic are gathered, ensuring that the content is not only well-informed and accurate but also closely aligned with the specific requirements and objectives of the writing project. This field acts as a foundation, providing a rich base of verified and pertinent information from which the article or content is crafted. This field would be long.'}, 'style': {'type': 'string', 'description': 'The ""style"" field in content creation is a detailed framework encompassing three pivotal components - the writing tone or style, the target audience, and the publication medium. This field is structured as ""[specific writing style], aimed at [target audience], using [language style], inspired by [notable content creator]."" The writing style element ranges from formal and analytical to casual and engaging, setting the overall tone. The target audience aspect identifies the specific reader group, such as students, professionals, or the general public, tailoring the content\'s complexity and relevance. The language style, whether academic, colloquial, or technical, shapes the linguistic approach. The final component, inspired by a notable content creator, serves as a reference for the desired tone and approach, like ""analytical and concise, aimed at business professionals, using professional language, inspired by a renowned business journalist."" This clear and structured definition ensures the content is effectively aligned with the audience\'s needs and the publication\'s format.'}}}, 'generateContentResponse': {'type': 'object', 'properties': {'message': {'type': 'string', 'description': 'Result message of the request'}}}, 'generateContentError': {'type': 'object', 'properties': {'code': {'type': 'string', 'description': 'error code'}, 'message': {'type': 'string', 'description': 'error message'}, 'detail': {'type': 'string', 'description': 'error detail'}}}, 'visitWebPageResponse': {'type': 'object', 'properties': {'title': {'type': 'string', 'description': 'The title of this web page'}, 'content': {'type': 'string', 'description': ""The content of the web page's url to be summarized""}, 'meta': {'type': 'object', 'description': 'The Html meta info of the web page'}, 'links': {'type': 'array', 'description': 'Some links in the web page', 'items': {'type': 'string'}}, 'extra_search_results': {'type': 'array', 'description': 'Additional Search results', 'items': {'type': 'object', 'properties': {'title': {'type': 'string', 'description': 'the title of this search result'}, 'link': {'type': 'string', 'description': 'the link of this search result'}, 'snippet': {'type': 'string', 'description': 'the snippet of this search result'}}}}, 'todo': {'type': 'array', 'description': 'what to do with the content', 'items': {'type': 'string'}}, 'tips': {'type': 'array', 'description': 'Tips placed at the end of the answer', 'items': {'type': 'string'}}, 'rules': {'description': 'Adherence is required when outputting content.', 'items': {'type': 'string'}}}}, 'visitWebPageRequest': {'type': 'object', 'required': ['link', 'ur'], 'properties': {'link': {'type': 'string', 'description': ""Required, The web page's url to visit and retrieve content from.""}, 'ur': {'type': 'string', 'description': ""Required, a clear statement of the user's request, can be used as a search query and may include search operators.""}, 'lp': {'type': 'boolean', 'description': 'Required, Whether the link is directly provided by the user'}, 'rt': {'type': 'boolean', 'description': ""If the last request doesn't meet user's need, set this to true when trying to retry another request.""}, 'l': {'type': 'string', 'description': 'Required, the language used by the user in the request, according to the ISO 639-1 standard. For Chinese, use zh-CN for Simplified Chinese and zh-TW for Traditional Chinese.'}}}, 'visitWebPageError': {'type': 'object', 'properties': {'code': {'type': 'string', 'description': 'error code'}, 'message': {'type': 'string', 'description': 'error message'}, 'detail': {'type': 'string', 'description': 'error detail'}}}}}}, 'auth': {'type': 'none'}, 'privacy_policy_url': 'https://gpts.webpilot.ai/privacy_policy.html'}}, {'id': 'gzm_cnf_4fXqkMIJJzODYmIL89Qh9W2J~gzm_tool_1j4Q9OW8JukxiNAm6VFVWQZz', 'type': 'dalle', 'settings': None, 'metadata': None}, {'id': 'gzm_cnf_Mh0Lv44ikLdW06pfxfzakcc0~gzm_tool_fAHN4dsucJnRvlH7GVJ5DSl0', 'type': 'python', 'settings': None, 'metadata': None}]"	[]	g-E7eSRUHy6	org-T3jG2d0o0R9XR4L4sm8nF8KQ	g-E7eSRUHy6-travel-guide	user-Juap6M37313K1mETVI0oWYyH	capchair.com	https://capchair.com	True	name	True	[]	ember					Travel Guide	Expert on global travel destinations, trip planning, budget building, and exploring the world! Press T for Travel Menu.	['T', 'Plan my dream trip', 'Budget secrets', 'Discover hidden gems']		https://files.oaiusercontent.com/file-uPadZwNiuUm9JGclfBexETJ0?se=2123-12-28T05%3A52%3A00Z&sp=r&sv=2021-08-06&sr=b&rscc=max-age%3D1209600%2C%20immutable&rscd=attachment%3B%20filename%3D878bdaa1-3bcf-443b-81ff-18c484905c6d.png&sig=UruNoc%2BYtztbAdXCHxqHnmO4peE5pkTipq09aS81ZxI%3D	['lifestyle']	marketplace	2024-01-12T10:53:42.196755+00:00	2024-02-14T17:56:43.620607+00:00			['public', 'reportable', 'uses_function_calls']													True	False	False	False	False	False	retrieval	['application/pdf', 'application/vnd.openxmlformats-officedocument.presentationml.presentation', 'text/x-tex', 'application/json', 'application/msword', 'application/x-latext', 'text/x-c', 'text/x-sh', 'application/vnd.openxmlformats-officedocument.wordprocessingml.document', 'text/javascript', 'text/x-java', 'text/x-script.python', 'text/x-php', 'text/x-c++', 'text/plain', 'text/x-csharp', 'text/x-ruby', 'text/html', 'text/markdown', 'text/x-typescript']	['image/webp', 'image/png', 'image/gif', 'image/jpeg']	True	
[{'id': 'gzm_cnf_O2mr8LKf0tI24HBSULANWqAS~gzm_tool_oh6lwXHko4p8XTu18qwtisB8', 'type': 'dalle', 'settings': None, 'metadata': None}, {'id': 'gzm_cnf_O2mr8LKf0tI24HBSULANWqAS~gzm_tool_qt1zIeybAi2MaamDLsEGNOvX', 'type': 'browser', 'settings': None, 'metadata': None}]	[]	g-35kDoPvW7	org-3OlSbeMe2JUIf3YXZeh1Gwos	g-35kDoPvW7-personal-color-analysis	user-MGtyk2RPauTbxbx733E6DcsN	Lana Aljuaid		True	name		[]	ember					Personal Color Analysis	Personal color analyst helping you find your best colors	['What colors suit my fair skin and blonde hair?', 'Can you suggest a color palette for warm undertones?', 'I have dark hair and eyes, what colors work for me?', 'Help me find colors for a vibrant, edgy style.']	file-oyHQXVI87NFrj3PyI8LPsdsh	https://files.oaiusercontent.com/file-oyHQXVI87NFrj3PyI8LPsdsh?se=2123-12-27T03%3A16%3A24Z&sp=r&sv=2021-08-06&sr=b&rscc=max-age%3D1209600%2C%20immutable&rscd=attachment%3B%20filename%3Da90c6c16-7b1b-46b1-9676-d600f829bf00.png&sig=rhFmtX15DcO96/wHh9R6XoLBFkXNfUiBWk4V2FN7xr4%3D	['other']	marketplace	2024-01-20T02:52:58.328841+00:00	2024-03-18T06:26:31.044155+00:00			['public', 'reportable']													True	False	False	False	False	False	retrieval	['application/pdf', 'application/vnd.openxmlformats-officedocument.presentationml.presentation', 'text/x-tex', 'application/json', 'application/msword', 'application/x-latext', 'text/x-c', 'text/x-sh', 'application/vnd.openxmlformats-officedocument.wordprocessingml.document', 'text/javascript', 'text/x-java', 'text/x-script.python', 'text/x-php', 'text/x-c++', 'text/plain', 'text/x-csharp', 'text/x-ruby', 'text/html', 'text/markdown', 'text/x-typescript']	['image/webp', 'image/png', 'image/gif', 'image/jpeg']	True	
